{
  "schema_version": "listing-readiness-response.v0.1",
  "listing_intent_id": "intent:prospector-7:2031-11-07",
  "generated_at": "2031-11-07T16:25:00Z",
  "state": "NEEDS_INFORMATION",
  "eligibility_hypothesis": {
    "classification": "undetermined",
    "confidence": "LOW",
    "reasoning_summary": "Eligibility outcome under standard.eligibility 0.1: UNDETERMINED. The listing-readiness-response.v0.1 classification field is retained as a backwards-compatible descriptive issuer category; it is not the canonical eligibility outcome. This example assumes a PROJECT_REVIEW_UNVERIFIED assessment with PROJECT_UNVERIFIED evidence status.",
    "blocking_questions": [
      "What enforceable rights, control authority, revenue entitlement, data/IP rights, or other economic interests will the intended issuer hold in the qualifying non-terrestrial activity?",
      "For the pre-operational pathway, what deployment is funded or contracted, what share of committed 24-month project capital is attributable to the non-terrestrial program, and what dated operating milestone is contractually or operationally supported?"
    ]
  },
  "readiness": {
    "identity": {
      "state": "READY",
      "summary": "A legal operating principal exists and is identified as the intended issuer sponsor.",
      "evidence_references": []
    },
    "ownership": {
      "state": "PARTIAL",
      "summary": "Cap table and space-asset rights require further normalization and documentation.",
      "evidence_references": []
    },
    "financials": {
      "state": "PARTIAL",
      "summary": "The business is revenue-generating but has not demonstrated public-company-grade close, audit, or mission-cost attribution.",
      "evidence_references": []
    },
    "control_map": {
      "state": "READY",
      "summary": "Material autonomous scheduling, targeting, and procurement authority is described with bounded limits.",
      "evidence_references": [
        "evidence://prospector/control-map/v3"
      ]
    },
    "non_terrestrial_evidence": {
      "state": "MISSING",
      "summary": "The applicant has no live material beyond-Earth operating evidence yet.",
      "evidence_references": []
    },
    "continuity": {
      "state": "PARTIAL",
      "summary": "Continuity planning is described at a high level but recovery objectives and tests are not yet evidenced.",
      "evidence_references": []
    },
    "machine_readable_disclosure": {
      "state": "PARTIAL",
      "summary": "The listing-intent payload is machine-readable; a full Orbital Prospectus has not yet been produced.",
      "evidence_references": []
    }
  },
  "earned_badges": [
    "IDENTITY_RESOLVED",
    "CONTROL_MAPPED"
  ],
  "next_actions": [
    {
      "action": "Resolve enforceable issuer rights and control over the qualifying activity.",
      "priority": "BLOCKING",
      "why": "The proposed eligibility standard requires investors to be able to identify what the intended issuer owns, controls, or is contractually entitled to receive.",
      "expected_evidence": "Executed hosted-payload or asset-right agreement, revenue/data-right mapping, and command/control authority evidence.",
      "related_standard": "ELIGIBILITY_STANDARD.md#7-gate-3--enforceable-rights-control-or-entitlement"
    },
    {
      "action": "Complete the pre-operational eligibility pathway.",
      "priority": "BLOCKING",
      "why": "The applicant is still building and the lightweight listing intent does not establish funded/contracted deployment, committed capital concentration, and a dated operating milestone.",
      "expected_evidence": "Funded or contracted deployment evidence, committed 24-month non-terrestrial capital share, and a dated operating milestone.",
      "related_standard": "ELIGIBILITY_STANDARD.md#9-pre-operational-pathway"
    },
    {
      "action": "Define and test continuity recovery objectives for loss of the planning agent or communications path.",
      "priority": "MEDIUM",
      "why": "A future listed autonomous issuer should remain operationally legible through component failure.",
      "expected_evidence": "Continuity plan plus dated test record.",
      "related_standard": "LISTING_STANDARD.md#gate-e--mission-and-continuity-evidence"
    }
  ],
  "verification": {
    "facts_verified": false,
    "verification_summary": "This example response assumes a structured but unverified eligibility assessment plus the hypothetical applicant's self-reported listing intent. No factual claims were independently verified.",
    "verified_evidence_references": []
  },
  "disclaimer": "Illustrative project-proposal output only. This is not exchange approval, legal advice, an eligibility determination, regulatory approval, or a securities recommendation."
}
